<dataset xmlns:xsi="http://www.w3.org/2001/XMLSchema-instance" xsi:noNamespaceSchemaLocation="../dataset.xsd">

	<!--other roles-->
	<user id="1534984901" version="@auto" username="@auto" email="@auto" name="@auto" password_hash="@auto"
	      status="active" roles="user,other1,other2"/>
	<session token="other" created="@auto" duration="90" expires="@timestamp+PT1M" user="1534984901"/>

	<!--single correct role-->
	<user id="1534984902" version="@auto" username="@auto" email="@auto" name="@auto" password_hash="@auto"
	      status="active" roles="admin"/>
	<session token="single" created="@auto" duration="90" expires="@timestamp+PT1M" user="1534984902"/>

	<!--multiple roles, authorized-->
	<user id="1534984903" version="@auto" username="@auto" email="@auto" name="@auto" password_hash="@auto"
	      status="active" roles="user,admin,other1"/>
	<session token="multiple" created="@auto" duration="90" expires="@timestamp+PT1M" user="1534984903"/>

	<!--disabled-->
	<user id="1534984904" version="@auto" username="@auto" email="@auto" name="@auto" password_hash="@auto"
	      status="disabled" roles="admin"/>
	<session token="disabled" created="@auto" duration="90" expires="@timestamp+PT1M" user="1534984904"/>

</dataset>
